{
  "plugin_id": "gen-py-ssh_creds",
  "plugin_type": "flag-generator",
  "version": "1.0",
  "description": "Converted from generator id 'gen.py.ssh_creds'.",
  "requires": ["seed", "secret"],
  "produces": [
    {"artifact": "ssh_username"},
    {"artifact": "ssh_password"},
    {"artifact": "artifact_path"}
  ],
  "inputs": {
    "seed": {"type": "string", "required": true},
    "secret": {"type": "string", "required": true},
    "username_prefix": {"type": "string", "required": false}
  }
}
