{
  "plugin_id": "gen-c-hidden_text_binary",
  "plugin_type": "flag-generator",
  "version": "1.0",
  "description": "Converted from generator id 'gen.c.hidden_text_binary'.",
  "requires": [],
  "produces": [
    {"artifact": "binary_path"},
    {"artifact": "hidden_text"},
    {"artifact": "hidden_checksum"}
  ],
  "inputs": {
    "text": {"type": "string", "required": false},
    "seed": {"type": "string", "required": false}
  }
}
