{
  "plugin_id": "gen-c-basic_binary",
  "plugin_type": "flag-generator",
  "version": "1.0",
  "description": "Converted from generator id 'gen.c.basic_binary'.",
  "requires": ["secret"],
  "produces": [
    {"artifact": "binary_path"}
  ],
  "inputs": {
    "secret": {"type": "string", "required": true}
  }
}
