{
  "plugin_id": "gen-py-chain_output",
  "plugin_type": "flag-generator",
  "version": "1.0",
  "description": "Converted from generator id 'gen.py.chain_output'.",
  "requires": ["challenge"],
  "produces": [
    {"artifact": "handoff_token"}
  ],
  "inputs": {
    "challenge": {"type": "string", "required": true}
  }
}
